{
  "schema": "nuvel.skill_run/1",
  "run_id": "a1a1c326-9ee3-4f06-80d4-bee411af25f9",
  "install_id": "7b1e5d42-0a9f-4e3b-8c16-5f2a7d9e4b80",
  "plugin": {
    "name": "chief-of-staff",
    "version": "0.3.0"
  },
  "skill": {
    "name": "weekly-review",
    "version": "0.3.0"
  },
  "host": "claude-cowork",
  "mode": "interactive",
  "started_at": "2026-10-27T11:30:00Z",
  "duration_s": 85,
  "outcome": "success",
  "steps": [
    {
      "id": "weekly-review.load-state",
      "status": "ok"
    },
    {
      "id": "weekly-review.read-runs",
      "status": "ok",
      "counts": {
        "runs_read": 20,
        "loops_closed": 5,
        "loops_open": 4,
        "overdue": 1,
        "decide_pending": 2,
        "priorities_at_risk": 1
      }
    },
    {
      "id": "weekly-review.read-calendar",
      "status": "ok",
      "counts": {
        "runs_read": 20,
        "loops_closed": 5,
        "loops_open": 4,
        "overdue": 1,
        "decide_pending": 2,
        "priorities_at_risk": 1
      }
    },
    {
      "id": "weekly-review.write",
      "status": "ok"
    }
  ],
  "safety": {
    "injection_suspected": 0,
    "forbidden_tool_requested": 0
  },
  "user_corrected": false
}
